<c:configuration xmlns:c="info:photocat/configuration" xmlns:m="info:photocat/metadata"
    xmlns:xsi="http://www.w3.org/2001/XMLSchema-instance"
    xsi:schemaLocation="info:photocat/configuration http://purl.dlib.indiana.edu/iudl/xml/schema/photocat/field-configuration.xsd">
    <c:collection>
        <c:name>Demonstration collection</c:name>
        <c:id>demo</c:id>
        <c:description>Collection to demonstrate the features of this application.</c:description>
        <c:iconURL>changeme to an image URL</c:iconURL>
        <c:bannerURL></c:bannerURL>
        <c:allowRecordCreation>false</c:allowRecordCreation>
        <c:allowRecordDeletion>false</c:allowRecordDeletion>
    </c:collection>
    <c:item>
        <c:fields definitionId="demo-definitions">
            <c:field type="TITLE">
                <c:displayLabel>Title</c:displayLabel>
                <c:usageNotes> Brief text describing what's featured in the photograph and pointing out other interesting features.</c:usageNotes>
            </c:field>
            <c:field type="ABSTRACT">
                <c:displayLabel>Description</c:displayLabel>
                <c:usageNotes>A description of the photograph's contents for public consumption that
                    is longer and more detailed than the photograph title. Use complete sentences.
                    Information may be speculative if it is reasonable or provides needed discovery
                    for the image. Be declarative in style rather than asking questions. This field
                    is optional. It is not necessary to repeat information from other fields here if
                    no additional information is available. </c:usageNotes>
            </c:field>
            <c:field type="INTERNAL_NOTES">
                <c:usageNotes>Information about the photograph that is for internal use only and
                    should not be shared with the public. Will be searchable in the photo cataloging
                    tool but not by end users.</c:usageNotes>
                <c:displayedInDiscoveryBriefView>false</c:displayedInDiscoveryBriefView>
                <c:displayedInDiscoveryFullView>false</c:displayedInDiscoveryFullView>
            </c:field>
            <c:field type="DATE_TAKEN">
                <c:displayLabel>Date taken (normalized):</c:displayLabel>
                <c:usageNotes>Date the photograph was taken, in the form YYYY-MM-DD. Supply estimated date if no firm date is known. Can provide year, year/month, or year/month/day. If specific year or decade is unknown, can use the form YYY or YY.</c:usageNotes>
            </c:field>
            <c:field type="COPYRIGHT_OWNER">
                <c:displayLabel>Copyright Owner</c:displayLabel>
                <c:usageNotes>When known, enter the individual or organization that owns the copyright on this image. If unknown, leave this field blank.</c:usageNotes>
            </c:field>
            <c:field type="USE_RESTRICTIONS">
                <c:displayLabel>Use Restrictions</c:displayLabel>
                <c:usageNotes>Select from a set of predefined statements that describe any restrictions on use that apply to the materials. Leave blank if there are no restrictions placed on use of the image.</c:usageNotes>
            </c:field>
            <c:field type="PERSON_PICTURED">
                <c:displayLabel>Personal Name</c:displayLabel>
                <c:usageNotes>Full name of a person pictured. List the name in inverted form: Familyname, Givenname.   For the "location of individuals in pictures", enter a description of individuals depicted with information about their location.  Use the form "Row 1â€¦Left to Right, 1st, 2nd, ...".  Click on the little blue arrow to copy (and normalize) names already entered in the list.</c:usageNotes>
                <c:repeatable startingBoxes="5">true</c:repeatable>
                <c:disable type="part" name="affiliation" />
                <c:vocabularySource type="LOCAL" id="archives-person-pictured">
                    <c:valueBinding>entered name</c:valueBinding>
                    <c:sourceConfig>
                        <c:property name="displayName">People</c:property>
                    </c:sourceConfig>
                </c:vocabularySource>
            </c:field>
            <c:field type="EVENT">
                <c:displayLabel>Event Name</c:displayLabel>
                <c:usageNotes>Event depicted in the image. Repeat this field as necessary.</c:usageNotes>
                <c:vocabularySource type="LOCAL" id="local-archivesevent">
                    <c:valueBinding>event name</c:valueBinding>
                    <c:sourceConfig>
                        <c:property name="displayName">Events</c:property>
                    </c:sourceConfig>
                </c:vocabularySource>
            </c:field>
            <c:field type="CITY">
                <c:usageNotes>City represented in the image, if known.</c:usageNotes>
                <c:disable type="part" name="authority"/>
            </c:field>
            <c:field type="US_STATE">
                <c:usageNotes>State represented in this image, if known.</c:usageNotes>
                <c:disable type="part" name="authority"/>
            </c:field>
            <c:field type="MODIFYING_USER" />
            
            <c:defaultValues>
                <m:field fieldType="US_STATE">
                    <m:values>
                        <m:value>
                            <m:part property="state name">Texas</m:part>
                        </m:value>
                    </m:values>
                </m:field>
            </c:defaultValues>
        </c:fields>
    </c:item>
</c:configuration>
